<?xml version="1.0" encoding="UTF-8"?>
<!DOCTYPE pedidos SYSTEM "pedidos.dtd">
<pedidos>

    <pedido>
        <empresa CIF="CIF123" sector="tecnologia" actividad="desarrollo web formacion">
            DevSolutions S.L.
        </empresa>
        <productos>
            <producto id="p1">Portátil</producto>
            <producto id="p2">Monitor 27"</producto>
        </productos>
        <fecha>2025-05-31</fecha>
        <factura numfactura="f1" cliente="CIF123" productos="p1 p2">
            <emisor>&MiEmpresa;</emisor>
            <total>1800.00</total>
            <fecha>2025-06-01</fecha>
        </factura>
    </pedido>

    <pedido>
        <persona NIF="12345678A">
            María López
        </persona>
        <productos>
            <producto id="p3">Teclado mecánico</producto>
        </productos>
        <fecha>2025-06-02</fecha>
        <factura numfactura="f2" cliente="12345678A" productos="p3">
            <emisor>&MiEmpresa;</emisor>
            <total>120.00</total>
            <fecha>2025-06-03</fecha>
        </factura>
    </pedido>

</pedidos>
